{
 "source": {
  "tracker": "tracker.md",
  "handbook": "handbook.md",
  "about": "docs/index.html#sec-about",
  "aaf": "build/aaf-crosscheck.json"
 },
 "downloads": {
  "handbook_pdf": "downloads/handbook.pdf",
  "handbook_md": "downloads/handbook.md",
  "tracker_md": "downloads/tracker.md"
 },
 "intro": {
  "title": "US Frontier AI Legislation Tracker (2025–2026)",
  "paragraphs": [
   "Compiled for the frontier AI law audit project. \"Frontier\" = laws/bills targeting the largest AI developers and catastrophic risk from advanced models, plus the independent-verification-organization (IVO) / AI-auditor licensing bills that form a distinct sub-category. Section J lists items checked and **excluded**."
  ],
  "confidence_key_intro": "**Confidence key** (applies to the row as a whole; individual cells noted where they differ):",
  "confidence_key": [
   {
    "level": "HIGH",
    "text": "the load-bearing proposition was checked directly against an operative primary record (statute/bill text, official legislature action page, rule/order, docket or first-party program record)"
   },
   {
    "level": "MED-HIGH",
    "text": "strong corroboration, but a load-bearing primary record is nonpublic, inaccessible, or does not itself establish the full proposition"
   },
   {
    "level": "MED",
    "text": "two or more concurring reputable secondary sources; primary material does not establish the key detail"
   },
   {
    "level": "SEARCH-QUALIFIED",
    "text": "a date-bounded negative finding (for example, \"no case located\"), not proof that an event does not exist"
   },
   {
    "level": "LOW",
    "text": "single source, or key details thin/unverified"
   }
  ],
  "verification_note": "Verified as of **September 5, 2026**. Legislative status changes weekly — re-check the primary link before citing. Confidence is assessed **per claim** where cells differ; the row rating is the weakest load-bearing claim in the row. Items marked ⟨R⟩ were first identified by an external review (Sept. 4, 2026) and then independently checked unless a cell expressly says otherwise. ⟨NCSL⟩ marks an item discovered in the final NCSL keyword cross-check. ⟨U⟩ marks a row added or changed in a supplementary check through **September 29, 2026**; those rows carry their own dates and ratings, and the Sept. 5 recertification statement below does not cover them (see the supplementary note at the end of Section L)."
 },
 "section_notes": {
  "A": [
   "Votes (ilga.gov roll calls): SB 315 passed IL Senate **52-5-2 NV** (May 21, 2026) and House **110-0-4 NV** (May 27, 2026); both Executive Committees unanimous. Anthropic publicly supported SB 315 and the MA bill; OpenAI praised the IL process — noted because industry positioning is itself a variable for the audit.",
   "**Verification status (Sept. 5, 2026):** HIGH from primary documents — all three Category A laws; CT Public Act 26-15; the TN H.B. 1898/S.B. 2171 introduced text and official amended-bill fiscal summary; IL H.B. 3506 amendment, H.B. 4705 text, S.B. 3261/H.B. 4799 status, and S.B. 3444 sponsor; LA S.B. 474 engrossed text; the introduced texts of H.R. 9925, S. 2938, S. 5061, H.R. 9914/S. 5105, H.R. 9477, H.R. 9965, **H.R. 9917**, S. 4656, H.R. 10180, and H.R. 10189; **EO 14409**; **NIST AITE**; the federal export-control rules in Section G.3; CA S.B. 1047; the Senate's 99–1 moratorium roll call; all Category E frameworks and the Sanders–Casar announcement; the Anthropic v. Department of War complaint; and the other items whose rows say HIGH. MED-HIGH remains appropriate where the operative government record is nonpublic or a proposition rests partly on reporting: the June 12 model-access directive's issuing authority and rationale, and the Aug. 7 Trump remarks. Negative findings are marked SEARCH-QUALIFIED rather than being promoted to HIGH. **No cell is rated LOW.**"
  ],
  "B.2": [
   "Reviewer correctly flagged that this bill does not belong in Section B: it uses catastrophic-risk machinery but applies to *every* AI developer."
  ],
  "C": [
   "Distinct from Section A: these regulate *who may audit* frontier developers rather than the developers directly. Directly relevant to the SB 315 audit-provision case study."
  ],
  "G.2": [
   "Searches through **Sept. 5, 2026** located no court challenge or reported enforcement action involving an enacted state frontier law. This is a **date-bounded negative finding, not proof of universal absence**. Litigation has nevertheless begun around federal executive treatment of a frontier developer and the administration's undisclosed pre-release review framework."
  ],
  "G.3": [
   "Upstream of every developer mandate above. Executive and legislative, none of it in the \"frontier law\" template."
  ]
 },
 "section_headings": {
  "A": "A. Enacted state frontier-developer laws (the core template)",
  "B": "B. Pending, stalled, and failed state frontier-developer bills (status class shown in bold at start of Status cell)",
  "B.2": "B.2 Catastrophic-risk regulation **without** a frontier threshold",
  "C": "C. State IVO / AI-auditor licensing measures",
  "D": "D. Federal frontier-AI bills — formally introduced (none enacted)",
  "E": "E. Federal frameworks — discussion drafts / non-binding (not introduced bills)",
  "F": "F. Federal AI bills — adjacent or sectoral (not general frontier-developer regulation)",
  "G": "G. Executive actions (not legislation)",
  "G.2": "G.2 Frontier-AI litigation and enforcement (as of Sept. 5, 2026)",
  "G.3": "G.3 Compute and export-control layer (governs who can build frontier models)",
  "H": "H. Precursors, withdrawn proposals, and legislative history",
  "I": "I. Adjacent — partial frontier provisions inside broader AI laws",
  "J": "J. Checked and excluded (with reason)",
  "K": "K. Cross-cutting divergences (raw material for the ambiguity taxonomy)",
  "K.2": "K.2 Assurance layers",
  "L": "L. Completeness methodology and known gaps"
 },
 "comparison": {
  "heading": "K. Cross-cutting divergences (raw material for the ambiguity taxonomy)",
  "columns": [
   "CA SB 53",
   "NY RAISE (amended)",
   "IL SB 315",
   "MI HB 4668",
   "NJ S.4446/A.5275",
   "MA (Senate text)",
   "H.R. 9925 FRONTIER"
  ],
  "clusters": "**Two textual clusters (from primary texts; similarity ≠ proven copying):** *Original-RAISE / SSP cluster* — IL HB 3506 (filed Feb 7, 2025), NY S.6953 as passed June 2025, MI HB 4668 (June 24, 2025), MN HF 4532 (Mar 2026, threshold removed). Illinois's bill predates New York's passage, so direction of influence within this cluster is not established; the shared features (compute-cost thresholds, 90-day reports, annual audit, whistleblower private action) point to a common drafting source rather than sequential copying. *TFAIA cluster* — CA SB 53 (Sept 2025) → NY Chapter 96 (Mar 2026) → IL SB 315 (July 2026, + audit), with MA H.5576's Senate text, LA SB 474, TN HB 1898, **UT HB 286**, and NJ S.4446/A.5275 as variants. **Supportable claim:** New York and Illinois demonstrably shifted from the SSP/audit structure toward the TFAIA framework (NY by amending its own law; IL by moving away from HB 3506 to SB 315); Michigan and Minnesota retain variants of the earlier approach.",
  "assurance": {
   "heading": "K.2 Assurance layers",
   "intro": [
    "One \"third-party audit\" column hid the distinction that matters most for the paper. Three separable layers:"
   ],
   "columns": [
    "**Jurisdiction / bill**",
    "**1. Developer self-governance (published framework + disclosures)**",
    "**2. Compliance audit (did the developer follow its own framework?)**",
    "**3a. Independent technical risk evaluation (does the model pose catastrophic risk?)**",
    "**3b. Auditor/evaluator accreditation (who may perform 2 or 3a?)**"
   ],
   "rows": [
    [
     "CA SB 53 (+ AB 1405 / SB 813 on Governor's desk)",
     "yes",
     "—",
     "—",
     "**AB 1405: mandatory registration for anyone conducting a state-law-required AI audit (from 2029); SB 813: voluntary GovOps-designated IVOs (by 2028)**"
    ],
    [
     "NY RAISE (enacted)",
     "yes",
     "**removed**",
     "—",
     "—"
    ],
    [
     "NY S.10373 (pending)",
     "—",
     "**annual**",
     "partly (verifier checks statements vs. findings)",
     "**DFS accreditation, mandatory from 2029**"
    ],
    [
     "NY S.10456 (pending)",
     "**state-set minimum standards** for the framework",
     "—",
     "—",
     "—"
    ],
    [
     "IL SB 315",
     "yes",
     "annual (2028)",
     "—",
     "auditor-independence rules only"
    ],
    [
     "MI HB 4668",
     "yes",
     "annual",
     "—",
     "—"
    ],
    [
     "MA (Senate text)",
     "yes",
     "—",
     "**every 120 days**",
     "—"
    ],
    [
     "NJ S.4446/A.5275",
     "yes (to AG, NIST-RMF-mapped)",
     "discretionary AG audit",
     "—",
     "—"
    ],
    [
     "LA SB 474",
     "yes",
     "annual (2028) + self-certification",
     "—",
     "—"
    ],
    [
     "TN HB 1898",
     "yes",
     "\"independent reviews\"",
     "—",
     "—"
    ],
    [
     "UT HB 286",
     "yes",
     "—",
     "child-risk assessments may involve third-party evaluators",
     "—"
    ],
    [
     "MN HF 4532 (no threshold)",
     "yes (protocol)",
     "—",
     "—",
     "—"
    ],
    [
     "CT SB 5",
     "—",
     "—",
     "pilot participants may seek verification",
     "DCP-administered IVO **pilot through June 30, 2030**"
    ],
    [
     "OH HB 628",
     "—",
     "—",
     "voluntary IVO verification",
     "**voluntary license**, IVO-defined scope"
    ],
    [
     "MN HF 4544 / SF 4636",
     "—",
     "—",
     "voluntary IVO verification with a rebuttable presumption against liability",
     "**risk-specific Commerce license**; advisory council; ongoing monitoring"
    ],
    [
     "VA Ch. 425/426",
     "—",
     "—",
     "—",
     "JCOTS **study**"
    ],
    [
     "H.R. 9925 FRONTIER",
     "yes",
     "annual (large tier)",